{
  "lesson_id": "LES-002",
  "business_id": "biz_akosmicanimals",
  "title": "Consistent branding is more valuable than rapidly expanding into unrelated niches",
  "summary": "Consistent branding is more valuable than rapidly expanding into unrelated niches.",
  "source": "review",
  "recommendation": "Keep the minimalist cat positioning rather than broadening into unrelated animal or product niches.",
  "owner": "Owner",
  "date": "2026-07-19",
  "created_at": "2026-07-19T09:00:00Z",
  "updated_at": "2026-07-19T09:00:00Z"
}
